{
  "deployId": "dep-daauu9navr4c738klj3g",
  "environment": "staging",
  "service": {
    "id": "srv-daatu9fqj5pc73b9ap0g",
    "name": "focx-staging",
    "publicUrl": "https://staging.focx.ai"
  },
  "expectedSha": "c15d0ddb591672d308b02d585819a9295a62ecf4",
  "deploy": {
    "status": "live",
    "servingSha": "c15d0ddb591672d308b02d585819a9295a62ecf4",
    "finishedAt": "2026-08-31T21:16:36.286463Z"
  },
  "health": {
    "httpStatus": 200,
    "tlsValid": true,
    "certificateSubject": "CN=staging.focx.ai",
    "checkedUrl": "https://staging.focx.ai/",
    "contentMarker": "<title>Focx</title>"
  },
  "customDomains": [
    {
      "name": "staging.focx.ai",
      "verified": false,
      "certificateIssued": true
    }
  ],
  "infraDrift": [],
  "outcome": "degraded"
}
